{
  "$schema": "../schema/index.schema.json",
  "version": "1.0.0",
  "updated": "2026-01-25",
  "totalSplits": 55,
  "years": [
    1971,
    1975,
    1980,
    1982,
    1983,
    1985,
    1987,
    1990,
    1991,
    1992,
    1993,
    1994,
    1996,
    1998,
    1999,
    2000,
    2001,
    2003,
    2004,
    2005,
    2006,
    2007,
    2014,
    2015,
    2020,
    2021,
    2022,
    2024,
    2025
  ],
  "bySymbol": {
    "WMT": {
      "name": "Walmart Inc.",
      "isin": "US9311421039",
      "exchange": "NYSE",
      "splits": [
        {
          "date": "2024-02-26",
          "ratio": "3:1"
        },
        {
          "date": "1999-03-19",
          "ratio": "2:1"
        },
        {
          "date": "1993-02-25",
          "ratio": "2:1"
        },
        {
          "date": "1990-06-15",
          "ratio": "2:1"
        },
        {
          "date": "1987-06-19",
          "ratio": "2:1"
        },
        {
          "date": "1985-09-03",
          "ratio": "2:1"
        },
        {
          "date": "1983-06-20",
          "ratio": "2:1"
        },
        {
          "date": "1982-06-21",
          "ratio": "2:1"
        },
        {
          "date": "1980-11-25",
          "ratio": "2:1"
        },
        {
          "date": "1975-08-22",
          "ratio": "2:1"
        },
        {
          "date": "1971-05-19",
          "ratio": "2:1"
        }
      ]
    },
    "AAPL": {
      "name": "Apple Inc.",
      "isin": "US0378331005",
      "exchange": "NASDAQ",
      "splits": [
        {
          "date": "2020-08-31",
          "ratio": "4:1"
        },
        {
          "date": "2014-06-09",
          "ratio": "7:1"
        },
        {
          "date": "2005-02-28",
          "ratio": "2:1"
        },
        {
          "date": "2000-06-21",
          "ratio": "2:1"
        },
        {
          "date": "1987-06-16",
          "ratio": "2:1"
        }
      ]
    },
    "MSFT": {
      "name": "Microsoft Corporation",
      "isin": "US5949181045",
      "exchange": "NASDAQ",
      "splits": [
        {
          "date": "2003-02-18",
          "ratio": "2:1"
        },
        {
          "date": "1999-03-29",
          "ratio": "2:1"
        },
        {
          "date": "1998-02-23",
          "ratio": "2:1"
        },
        {
          "date": "1996-12-09",
          "ratio": "2:1"
        },
        {
          "date": "1994-05-23",
          "ratio": "2:1"
        },
        {
          "date": "1992-06-15",
          "ratio": "3:2"
        },
        {
          "date": "1991-06-27",
          "ratio": "3:2"
        },
        {
          "date": "1990-04-16",
          "ratio": "2:1"
        },
        {
          "date": "1987-09-21",
          "ratio": "2:1"
        }
      ]
    },
    "AMZN": {
      "name": "Amazon.com, Inc.",
      "isin": "US0231351067",
      "exchange": "NASDAQ",
      "splits": [
        {
          "date": "2022-06-06",
          "ratio": "20:1"
        },
        {
          "date": "1999-09-02",
          "ratio": "2:1"
        },
        {
          "date": "1999-01-05",
          "ratio": "3:1"
        },
        {
          "date": "1998-06-02",
          "ratio": "2:1"
        }
      ]
    },
    "NVDA": {
      "name": "NVIDIA Corporation",
      "isin": "US67066G1040",
      "exchange": "NASDAQ",
      "splits": [
        {
          "date": "2024-06-10",
          "ratio": "10:1"
        },
        {
          "date": "2021-07-20",
          "ratio": "4:1"
        },
        {
          "date": "2007-09-11",
          "ratio": "3:2"
        },
        {
          "date": "2006-04-07",
          "ratio": "2:1"
        },
        {
          "date": "2001-09-17",
          "ratio": "2:1"
        },
        {
          "date": "2000-06-27",
          "ratio": "2:1"
        }
      ]
    },
    "NFLX": {
      "name": "Netflix, Inc.",
      "isin": "US64110L1061",
      "exchange": "NASDAQ",
      "splits": [
        {
          "date": "2025-11-14",
          "ratio": "10:1"
        },
        {
          "date": "2015-07-15",
          "ratio": "7:1"
        },
        {
          "date": "2004-02-12",
          "ratio": "2:1"
        }
      ]
    },
    "GOOG": {
      "name": "Alphabet Inc. (Class C)",
      "isin": "US02079K1079",
      "exchange": "NASDAQ",
      "splits": [
        {
          "date": "2022-07-18",
          "ratio": "20:1"
        },
        {
          "date": "2014-04-03",
          "ratio": "2:1",
          "notes": "Stock split created Class C shares"
        }
      ]
    },
    "GOOGL": {
      "name": "Alphabet Inc. (Class A)",
      "isin": "US02079K3059",
      "exchange": "NASDAQ",
      "splits": [
        {
          "date": "2022-07-18",
          "ratio": "20:1"
        },
        {
          "date": "2014-04-03",
          "ratio": "2:1",
          "notes": "Stock split created Class C shares"
        }
      ]
    },
    "TSLA": {
      "name": "Tesla, Inc.",
      "isin": "US88160R1014",
      "exchange": "NASDAQ",
      "splits": [
        {
          "date": "2022-08-25",
          "ratio": "3:1"
        },
        {
          "date": "2020-08-31",
          "ratio": "5:1"
        }
      ]
    },
    "COST": {
      "name": "Costco Wholesale Corporation",
      "isin": "US22160K1051",
      "exchange": "NASDAQ",
      "splits": [
        {
          "date": "2024-01-12",
          "ratio": "1:1",
          "notes": "Special dividend, not a split"
        }
      ]
    },
    "CMG": {
      "name": "Chipotle Mexican Grill, Inc.",
      "isin": "US1696561059",
      "exchange": "NYSE",
      "splits": [
        {
          "date": "2024-06-26",
          "ratio": "50:1"
        }
      ]
    },
    "AVGO": {
      "name": "Broadcom Inc.",
      "isin": "US11135F1012",
      "exchange": "NASDAQ",
      "splits": [
        {
          "date": "2024-07-15",
          "ratio": "10:1"
        }
      ]
    },
    "SMCI": {
      "name": "Super Micro Computer, Inc.",
      "isin": "US86800U1043",
      "exchange": "NASDAQ",
      "splits": [
        {
          "date": "2024-10-01",
          "ratio": "10:1"
        }
      ]
    },
    "PANW": {
      "name": "Palo Alto Networks, Inc.",
      "isin": "US6974351057",
      "exchange": "NASDAQ",
      "splits": [
        {
          "date": "2024-12-16",
          "ratio": "2:1"
        }
      ]
    },
    "CBSH": {
      "name": "Commerce Bancshares, Inc.",
      "isin": "US2005251036",
      "exchange": "NASDAQ",
      "splits": [
        {
          "date": "2025-12-02",
          "ratio": "21:20",
          "notes": "5% stock dividend (1.05-for-1)"
        }
      ]
    },
    "FAST": {
      "name": "Fastenal Company",
      "isin": "US3119001044",
      "exchange": "NASDAQ",
      "splits": [
        {
          "date": "2025-05-21",
          "ratio": "2:1"
        }
      ]
    },
    "IBKR": {
      "name": "Interactive Brokers Group, Inc.",
      "isin": "US45841N1072",
      "exchange": "NASDAQ",
      "splits": [
        {
          "date": "2025-06-17",
          "ratio": "4:1"
        }
      ]
    },
    "NOW": {
      "name": "ServiceNow, Inc.",
      "isin": "US81762P1021",
      "exchange": "NYSE",
      "splits": [
        {
          "date": "2025-12-17",
          "ratio": "5:1"
        }
      ]
    },
    "ORLY": {
      "name": "O'Reilly Automotive, Inc.",
      "isin": "US67103H1077",
      "exchange": "NASDAQ",
      "splits": [
        {
          "date": "2025-06-09",
          "ratio": "15:1"
        }
      ]
    },
    "TPL": {
      "name": "Texas Pacific Land Corporation",
      "isin": "US88262P1021",
      "exchange": "NYSE",
      "splits": [
        {
          "date": "2025-12-22",
          "ratio": "3:1"
        }
      ]
    }
  },
  "byIsin": {
    "US9311421039": "WMT",
    "US0378331005": "AAPL",
    "US5949181045": "MSFT",
    "US0231351067": "AMZN",
    "US67066G1040": "NVDA",
    "US64110L1061": "NFLX",
    "US02079K1079": "GOOG",
    "US02079K3059": "GOOGL",
    "US88160R1014": "TSLA",
    "US22160K1051": "COST",
    "US1696561059": "CMG",
    "US11135F1012": "AVGO",
    "US86800U1043": "SMCI",
    "US6974351057": "PANW",
    "US2005251036": "CBSH",
    "US3119001044": "FAST",
    "US45841N1072": "IBKR",
    "US81762P1021": "NOW",
    "US67103H1077": "ORLY",
    "US88262P1021": "TPL"
  }
}
